{
 "title": "Example maps",
 "name_label": "Map",
 "columns": [
  {
   "key": "water_m2",
   "label": "Water",
   "unit": "m\u00b2",
   "title": "Water surface area",
   "better": "high"
  },
  {
   "key": "trees",
   "label": "Trees",
   "better": "high"
  }
 ],
 "groups": {
  "Lakes": {
   "note": "still water"
  },
  "Rivers": {
   "note": "flowing water"
  }
 },
 "maps": [
  {
   "id": "mill-pond",
   "name": "Mill Pond",
   "group": "Lakes",
   "file": "maps/mill-pond.json",
   "stats": {
    "water_m2": 6453,
    "trees": 73
   },
   "tags": [
    "mesh"
   ]
  },
  {
   "id": "riverside-camp",
   "name": "Riverside Camp",
   "group": "Rivers",
   "file": "maps/riverside-camp.json",
   "stats": {
    "water_m2": 168000,
    "trees": 8
   },
   "version_label": "Built",
   "versions": [
    {
     "label": "Bridge draft",
     "file": "maps/riverside-camp-bridge.json",
     "note": "design draft, not built yet",
     "warn": true
    }
   ],
   "tags": [
    "cm units",
    {
     "text": "draft",
     "title": "Has a draft version",
     "warn": true
    }
   ]
  },
  {
   "id": "tiny-inline",
   "name": "Inline map",
   "group": "Lakes",
   "note": "defined inside the catalog",
   "map": {
    "name": "Inline map",
    "bounds": [
     -20,
     20,
     -20,
     20
    ],
    "areas": [
     {
      "polygon": [
       [
        8.1,
        0.0
       ],
       [
        8.01,
        0.89
       ],
       [
        8.05,
        1.83
       ],
       [
        8.0,
        2.85
       ],
       [
        7.65,
        3.89
       ],
       [
        6.93,
        4.85
       ],
       [
        5.88,
        5.67
       ],
       [
        4.63,
        6.36
       ],
       [
        3.22,
        6.94
       ],
       [
        1.68,
        7.41
       ],
       [
        0.0,
        7.68
       ],
       [
        -1.73,
        7.66
       ],
       [
        -3.39,
        7.3
       ],
       [
        -4.84,
        6.65
       ],
       [
        -6.04,
        5.82
       ],
       [
        -7.08,
        4.95
       ],
       [
        -8.05,
        4.1
       ],
       [
        -9.0,
        3.21
       ],
       [
        -9.82,
        2.23
       ],
       [
        -10.28,
        1.14
       ],
       [
        -10.23,
        0.0
       ],
       [
        -9.65,
        -1.07
       ],
       [
        -8.72,
        -1.98
       ],
       [
        -7.71,
        -2.75
       ],
       [
        -6.79,
        -3.45
       ],
       [
        -6.0,
        -4.2
       ],
       [
        -5.21,
        -5.02
       ],
       [
        -4.26,
        -5.86
       ],
       [
        -3.06,
        -6.6
       ],
       [
        -1.62,
        -7.15
       ],
       [
        -0.0,
        -7.49
       ],
       [
        1.73,
        -7.63
       ],
       [
        3.52,
        -7.59
       ],
       [
        5.32,
        -7.31
       ],
       [
        6.98,
        -6.72
       ],
       [
        8.28,
        -5.8
       ],
       [
        9.03,
        -4.59
       ],
       [
        9.18,
        -3.27
       ],
       [
        8.88,
        -2.02
       ],
       [
        8.43,
        -0.93
       ]
      ],
      "style": "water"
     }
    ],
    "objects": [
     {
      "shape": "tree",
      "pos": [
       14,
       12
      ]
     },
     {
      "shape": "rock",
      "pos": [
       -12,
       -9
      ]
     }
    ],
    "markers": [
     {
      "pos": [
       0,
       -14
      ],
      "label": "Start"
     }
    ]
   },
   "stats": {
    "water_m2": 221,
    "trees": 1
   }
  }
 ]
}